{
  "contract_name": "reason.code.registry",
  "contract_version": "1.0.0",
  "schema_version": "1.0.0",
  "tenant_id": "tenant-lab-001",
  "customer_context_id": "customer-context-main",
  "environment": "dry_run",
  "correlation_id": "corr-reason-registry-export-delete-deprecated-001",
  "causation_id": "taxonomy-governance-review-003",
  "idempotency_key": "idem-reason-registry-export-delete-deprecated-001",
  "producer": {
    "component": "compliance_reviewer",
    "produced_at": "2026-05-24T21:10:00Z"
  },
  "policy_version": "policy-phase0-v1",
  "taxonomy_version": "taxonomy-reason-v1",
  "registry_id": "rc-registry-003",
  "reason_code": "export_delete_review_required",
  "category": "export_delete",
  "status": "deprecated",
  "severity": "warning",
  "visibility": "operator_visible",
  "description": "Legacy export/delete review code retained for compatibility.",
  "evidence_required": false,
  "fail_closed_required": false,
  "introduced_in": "taxonomy-reason-v1",
  "deprecated_in": "taxonomy-reason-v2",
  "replaced_by": "export_delete_conflict_active",
  "aliases": [
    "export_delete_review_required_legacy"
  ],
  "created_at": "2026-05-24T21:10:00Z"
}
