{
  "contract_name": "reason.code.registry",
  "contract_version": "1.0.0",
  "schema_version": "1.0.0",
  "tenant_id": "tenant-lab-001",
  "customer_context_id": "customer-context-main",
  "environment": "dry_run",
  "correlation_id": "corr-reason-registry-recon-active-001",
  "causation_id": "taxonomy-governance-review-001",
  "idempotency_key": "idem-reason-registry-recon-active-001",
  "producer": {
    "component": "compliance_reviewer",
    "produced_at": "2026-05-24T21:00:00Z"
  },
  "policy_version": "policy-phase0-v1",
  "taxonomy_version": "taxonomy-reason-v1",
  "registry_id": "rc-registry-001",
  "reason_code": "recon_mismatched_approval_binding",
  "category": "reconciliation",
  "status": "active",
  "severity": "blocked",
  "visibility": "operator_visible",
  "description": "Approval binding metadata mismatched canonical reconciliation chain.",
  "evidence_required": true,
  "fail_closed_required": true,
  "introduced_in": "taxonomy-reason-v1",
  "deprecated_in": null,
  "replaced_by": null,
  "aliases": [],
  "created_at": "2026-05-24T21:00:00Z"
}
