{
  "contract_name": "reason.code.registry",
  "contract_version": "1.0.0",
  "schema_version": "1.0.0",
  "tenant_id": "tenant-lab-001",
  "customer_context_id": "customer-context-main",
  "environment": "blocked_mvp",
  "correlation_id": "corr-reason-registry-blocked-mvp-001",
  "causation_id": "taxonomy-governance-review-004",
  "idempotency_key": "idem-reason-registry-blocked-mvp-001",
  "producer": {
    "component": "security_reviewer",
    "produced_at": "2026-05-24T21:15:00Z"
  },
  "policy_version": "policy-phase0-v1",
  "taxonomy_version": "taxonomy-reason-v1",
  "registry_id": "rc-registry-004",
  "reason_code": "blocked_mvp_export_delete_execution",
  "category": "blocked_mvp",
  "status": "blocked",
  "severity": "blocked",
  "visibility": "operator_visible",
  "description": "Export/delete execution is blocked in MVP by policy.",
  "evidence_required": true,
  "fail_closed_required": true,
  "introduced_in": "taxonomy-reason-v1",
  "deprecated_in": null,
  "replaced_by": null,
  "aliases": [],
  "created_at": "2026-05-24T21:15:00Z"
}
